{
  "$schema": "https://json-schema.org/draft/2020-12/schema",
  "type": "object",
  "required": [
    "receipt_id",
    "receipt_type",
    "timestamp",
    "source_essays",
    "signal_id",
    "revocation_id",
    "signals",
    "assessment"
  ],
  "properties": {
    "receipt_id": {
      "type": "string"
    },
    "receipt_type": {
      "const": "gradient-exploitation-signal-receipt"
    },
    "timestamp": {
      "type": "string",
      "format": "date-time"
    },
    "source_essays": {
      "type": "array",
      "items": {
        "type": "string"
      }
    },
    "signal_id": {
      "type": "string"
    },
    "revocation_id": {
      "type": "string"
    },
    "signals": {
      "type": "array",
      "items": {
        "enum": [
          "execution-after-origin-revocation",
          "routing-to-stale-node",
          "delegation-during-lag-window",
          "replay-during-lag-window",
          "fail-open-observed",
          "cross-verifier-inconsistency"
        ]
      }
    },
    "assessment": {
      "type": "object",
      "required": [
        "risk_level",
        "intent_claimed"
      ],
      "properties": {
        "risk_level": {
          "enum": [
            "low",
            "medium",
            "high",
            "critical"
          ]
        },
        "intent_claimed": {
          "type": "boolean",
          "const": false
        },
        "note": {
          "type": "string"
        }
      }
    },
    "recommended_action": {
      "enum": [
        "monitor",
        "quarantine",
        "deny",
        "investigate",
        "require-revalidation"
      ]
    },
    "signature": {
      "type": "string"
    }
  },
  "additionalProperties": true
}
