{
  "receipt_id": "gesr-2026-04-27-001",
  "receipt_type": "gradient-exploitation-signal-receipt",
  "timestamp": "2026-04-27T09:34:00Z",
  "source_essays": [
    "https://thetrustgraph.substack.com/p/when-the-gradient-is-the-attack-surface",
    "https://thetrustgraph.substack.com/p/exploiting-the-revocation-lag-gradient"
  ],
  "signal_id": "signal://revocation-gradient/example/001",
  "revocation_id": "revocation://example/license-authority/42",
  "signals": [
    "routing-to-stale-node",
    "delegation-during-lag-window",
    "cross-verifier-inconsistency"
  ],
  "assessment": {
    "risk_level": "high",
    "intent_claimed": false,
    "note": "Signals indicate exploitable timing and routing behavior; the receipt does not assert actor intent."
  },
  "recommended_action": "investigate"
}
